{
  "schema_version": "0.1.0",
  "project": {
    "name": "voltage_divider",
    "source_format": "internal-json",
    "metadata": {
      "description": "Two-resistor voltage divider used as a minimal connectivity fixture."
    }
  },
  "components": [
    {
      "ref": "R1",
      "type": "resistor",
      "value": "10k",
      "symbol": "Device:R",
      "footprint": "Resistor_SMD:R_0603_1608Metric",
      "pins": [
        {
          "number": "1",
          "name": "A",
          "net": "VIN"
        },
        {
          "number": "2",
          "name": "B",
          "net": "VOUT"
        }
      ]
    },
    {
      "ref": "R2",
      "type": "resistor",
      "value": "10k",
      "symbol": "Device:R",
      "footprint": "Resistor_SMD:R_0603_1608Metric",
      "pins": [
        {
          "number": "1",
          "name": "A",
          "net": "VOUT"
        },
        {
          "number": "2",
          "name": "B",
          "net": "GND"
        }
      ]
    }
  ],
  "nets": [
    {
      "name": "VIN",
      "nodes": ["R1.1"]
    },
    {
      "name": "VOUT",
      "nodes": ["R1.2", "R2.1"]
    },
    {
      "name": "GND",
      "nodes": ["R2.2"]
    }
  ],
  "wires": [],
  "labels": [
    {
      "text": "VIN",
      "net": "VIN",
      "at": [20.0, 20.0]
    },
    {
      "text": "VOUT",
      "net": "VOUT",
      "at": [45.0, 20.0]
    },
    {
      "text": "GND",
      "net": "GND",
      "at": [45.0, 45.0]
    }
  ],
  "warnings": []
}
